{
  "$schema": "../../schemas/session.schema.json",
  "sessionId": "v331-tui-panels-20260209",
  "started": "2026-02-09T12:00:00Z",
  "lastActivity": "2026-02-09T13:00:00Z",
  "phase": "idle",
  "task": {
    "name": "v3.3.1 - Enhanced TUI Panels",
    "description": "COMPLETED. All 4 TUI panels built, bug-fixed, integrated, and tested. Version bumped to 3.3.1.",
    "artifacts": [
      "src/cli/repl/tui/panels/search.ts",
      "src/cli/repl/tui/panels/config.ts",
      "src/cli/repl/tui/panels/indexing.ts",
      "src/cli/repl/tui/panels/drift.ts",
      "src/cli/repl/index.ts",
      "tests/tui-panels.test.ts"
    ],
    "startedAt": "2026-02-09T12:00:00Z"
  },
  "context": {
    "tokensUsed": 0,
    "filesLoaded": [],
    "workflowsReferenced": []
  },
  "pendingUpdates": [],
  "notes": [
    "v3.3.1 development complete",
    "Build passes cleanly (tsc)",
    "82 tests pass (14 existing + 68 new TUI panel tests)",
    "Ready for commit and publish"
  ]
}
